{
  "$schema": "https://json-schema.org/draft/2020-12/schema",
  "$id": "device.heartbeat",
  "type": "object",
  "required": ["type", "eventId", "createdAt", "deviceId", "battery", "wifiRssi", "screen"],
  "properties": {
    "type": { "const": "device.heartbeat" },
    "eventId": { "type": "string", "minLength": 1 },
    "createdAt": { "type": "string", "minLength": 1 },
    "deviceId": { "type": "string", "minLength": 1 },
    "battery": { "type": "integer", "minimum": 0, "maximum": 100 },
    "wifiRssi": { "type": "integer", "minimum": -100, "maximum": 0 },
    "screen": { "type": "string", "minLength": 1 },
    "lastError": { "type": "string" },
    "errorRecoverable": { "type": "boolean" },
    "display": {
      "type": "object",
      "properties": {
        "petScale": { "type": "integer", "minimum": 1, "maximum": 32 },
        "uiTextScale": { "type": "integer", "minimum": 1, "maximum": 8 },
        "bodyTextScale": { "type": "integer", "minimum": 1, "maximum": 8 },
        "animationFps": { "type": "integer", "minimum": 4, "maximum": 20 },
        "motionStepMs": { "type": "integer", "minimum": 120, "maximum": 800 },
        "petOffsetX": { "type": "integer", "minimum": -1280, "maximum": 1280 },
        "petOffsetY": { "type": "integer", "minimum": -960, "maximum": 960 },
        "screenBackgroundRgba": { "$ref": "#/$defs/rgba" },
        "petBackgroundRgba": { "$ref": "#/$defs/rgba" },
        "textColorRgba": { "$ref": "#/$defs/rgba" },
        "textBackgroundRgba": { "$ref": "#/$defs/rgba" },
        "textBorderEnabled": { "type": "boolean" },
        "textBorderRgba": { "$ref": "#/$defs/rgba" },
        "beepOnAnswer": { "type": "boolean" },
        "visualProbe": { "type": "boolean" },
        "applyCount": { "type": "integer", "minimum": 0 },
        "lastEventId": { "type": "string" }
      }
    },
    "pet": {
      "type": "object",
      "properties": {
        "name": { "type": "string" },
        "state": { "type": "string" },
        "mood": {
          "type": "string",
          "enum": ["idle", "listening", "thinking", "happy", "surprised", "confused", "sleepy", "worried", "alert", "proud"]
        },
        "lastInteraction": { "type": "string" },
        "interactionCount": { "type": "integer", "minimum": 0 }
      }
    }
  },
  "$defs": {
    "rgba": {
      "type": "object",
      "required": ["r", "g", "b", "a"],
      "properties": {
        "r": { "type": "integer", "minimum": 0, "maximum": 255 },
        "g": { "type": "integer", "minimum": 0, "maximum": 255 },
        "b": { "type": "integer", "minimum": 0, "maximum": 255 },
        "a": { "type": "integer", "minimum": 0, "maximum": 255 }
      }
    }
  }
}
